{
  "$schema":"https://json-schema.org/draft/2020-12/schema",
  "$id":"https://design.mez.systems/schemas/expression-stress-proof-0.1.0.json",
  "type":"object",
  "additionalProperties":false,
  "required":["schemaVersion","proofId","version","status","productionAuthority","gateId","candidateRevision","taskId","title","thesis","authorityBoundary","coverage","suites","scenarios","acceptance","dependencies"],
  "properties":{
    "schemaVersion":{"const":"1.0.0"},
    "proofId":{"const":"mz.systems.expression.stress-proof"},
    "version":{"const":"0.1.0-candidate"},
    "status":{"const":"review-candidate"},
    "productionAuthority":{"const":false},
    "gateId":{"const":"H-EXP-08-EXPRESSION-STRESS-PROOF"},
    "candidateRevision":{"const":"expression-stress-01-r01"},
    "taskId":{"const":"TASK-EXP-08-EXPRESSION-STRESS-PROOF"},
    "title":{"type":"string","minLength":10},
    "thesis":{"type":"string","minLength":120},
    "authorityBoundary":{"type":"object","required":["mayCertify","mayRepair","mayNotChange"]},
    "coverage":{"type":"object","required":["viewports","containers","textZoom","contentModes","runtimeModes","inputModes"]},
    "suites":{"type":"array","minItems":6,"maxItems":6,"items":{"type":"object","additionalProperties":false,"required":["id","title","count","passRule"],"properties":{"id":{"enum":["reflow","content","fallback","accessibility","recovery","invariants"]},"title":{"type":"string"},"count":{"type":"integer","minimum":1},"passRule":{"type":"string","minLength":20}}}},
    "scenarios":{"type":"array","minItems":14,"maxItems":14,"items":{"type":"object","additionalProperties":false,"required":["id","suite","title","fixture","automatedChecks"],"properties":{"id":{"pattern":"^ST-[RTFASI][0-9]{2}$"},"suite":{"enum":["reflow","content","fallback","accessibility","recovery","invariants"]},"title":{"type":"string"},"fixture":{"type":"string"},"automatedChecks":{"type":"array","minItems":3,"items":{"type":"string"},"uniqueItems":true}}}},
    "acceptance":{"type":"object","required":["automatic","visual","human","consumerBoundary"]},
    "dependencies":{"type":"object","required":["disc","sphere","wingsMark","productCard","productComponents","tradingCard","websiteMotion","foundationManifest","productRegistry","gradientRegistry","wings"]}
  }
}
